{
  "book": "mega_act_s113_removal_grounds",
  "title": "H.R. 7300 § 113(a)(1) — grounds for removal from the official list",
  "source_id": "hr7300-ih",
  "includes": [
    "lib/enum_list"
  ],
  "categories": [
    {
      "name": "removal-grounds",
      "source": "§ 113(a)(1)(A)-(F)",
      "description": "The six grounds on which a State removes registrants determined to be ineligible.",
      "members": [
        {
          "symbol": "request-of-the-registrant",
          "source": "§ 113(a)(1)(A)",
          "text": "the request of the registrant;",
          "ace_noun": "n:request-of-the-registrant"
        },
        {
          "symbol": "criminal-conviction-or-mental-incapacity",
          "source": "§ 113(a)(1)(B)",
          "text": "criminal conviction or mental incapacity pursuant to State law;",
          "ace_noun": "n:criminal-conviction-or-mental-incapacity"
        },
        {
          "symbol": "death-of-the-registrant",
          "source": "§ 113(a)(1)(C)",
          "text": "the death of the registrant;",
          "ace_noun": "n:death-of-the-registrant"
        },
        {
          "symbol": "change-in-residence",
          "source": "§ 113(a)(1)(D)",
          "text": "a change in the residence of the registrant, in accordance with paragraph (2) and subsection (c);",
          "ace_noun": "n:change-in-residence"
        },
        {
          "symbol": "status-as-a-noncitizen",
          "source": "§ 113(a)(1)(E)",
          "text": "the registrant's status as a noncitizen, including on the basis of the immigration adjudication or status for naturalized citizenship of the registrant as provided by the Director of the United States Citizenship and Immigration Services or any other information with respect to citizenship status supplied by the Department of Homeland Security through the Systematic Alien Verification for Entitlements (``SAVE'') system that demonstrates a registrant is not a citizen of the United States; or",
          "ace_noun": "n:status-as-a-noncitizen"
        },
        {
          "symbol": "duplicate-registrations",
          "source": "§ 113(a)(1)(F)",
          "text": "duplicate registrations of a registrant otherwise eligible to vote.",
          "ace_noun": "n:duplicate-registrations"
        }
      ]
    }
  ],
  "rules": [
    {
      "name": "removal-ground-typep",
      "args": [
        "g"
      ],
      "label": "DEFINED_TERM",
      "source": "§ 113(a)(1)",
      "text": "to remove from the official list of eligible voters in elections for Federal office in the State registrants who are determined to be ineligible voters by reason of",
      "body": {
        "member": [
          "g",
          "removal-grounds"
        ]
      }
    }
  ]
}
